{
  "id": "M1",
  "title": "root: touches docs, no dependencies",
  "repo": "root",
  "base": "main",
  "branch": "m1-branch",
  "needs": [],
  "allowed_paths": ["docs/**"],
  "acceptance": [
    { "name": "exists", "cwd": ".", "command": "true", "expect_exit": 0 }
  ],
  "prompt_file": "fleet/prompts/M1.md",
  "model": "A",
  "max_turns": 10,
  "risk": "docs"
}
